<?xml version="1.0" encoding="UTF-8"?>
<xsd:schema xmlns:xsd="http://www.w3.org/2001/XMLSchema" xmlns:od="urn:schemas-microsoft-com:officedata">
<xsd:element name="dataroot">
<xsd:complexType>
<xsd:sequence>
<xsd:element ref="Articulos" minOccurs="0" maxOccurs="unbounded"/>
</xsd:sequence>
<xsd:attribute name="generated" type="xsd:dateTime"/>
</xsd:complexType>
</xsd:element>
<xsd:element name="Articulos">
<xsd:annotation>
<xsd:appinfo>
<od:index index-name="PrimaryKey" index-key="Tipo Num " primary="yes" unique="yes" clustered="no" order="asc asc"/>
<od:tableProperty name="GUID" type="9" value="sVCnsmN7UEuo6L4v6/cSsQ==
"/>
<od:tableProperty name="Orientation" type="2" value="0"/>
<od:tableProperty name="OrderByOn" type="1" value="0"/>
<od:tableProperty name="NameMap" type="11" value="CswOVQAAAACxUKeyY3tQS6jovi/r9xKxAAAAACJwrk16GeZAAAAAAAAAAABBAHIA
dABpAGMAdQBsAG8AcwAAAAAAAADMI/NZOZxHTK5bicqu0Yz/BwAAALFQp7Jje1BL
qOi+L+v3ErFUAGkAcABvAAAAAAAAAOMxW4S+aqhDhEDBdOYXAK8HAAAAsVCnsmN7
UEuo6L4v6/cSsU4AdQBtAAAAAAAAAOzmLbh0NlxKt4VkJw21rugHAAAAsVCnsmN7
UEuo6L4v6/cSsVQAaQB0AHUAbABvAAAAAAAAAO+/PRr3+P1MkdvMNazYX0kHAAAA
sVCnsmN7UEuo6L4v6/cSsUEAcgB0AGkAYwB1AGwAbwAAAAAAAAAAAAAAAAAAAAAA
AAAAAAAADAAAAAUAAAAAAAAAAAAAAAAAAAAAAA==
"/>
<od:tableProperty name="DefaultView" type="2" value="2"/>
<od:tableProperty name="DisplayViewsOnSharePointSite" type="2" value="1"/>
<od:tableProperty name="TotalsRow" type="1" value="0"/>
<od:tableProperty name="FilterOnLoad" type="1" value="0"/>
<od:tableProperty name="OrderByOnLoad" type="1" value="1"/>
<od:tableProperty name="HideNewField" type="1" value="0"/>
<od:tableProperty name="BackTint" type="6" value="100"/>
<od:tableProperty name="BackShade" type="6" value="100"/>
<od:tableProperty name="ThemeFontIndex" type="4" value="-1"/>
<od:tableProperty name="AlternateBackThemeColorIndex" type="4" value="-1"/>
<od:tableProperty name="AlternateBackTint" type="6" value="100"/>
<od:tableProperty name="AlternateBackShade" type="6" value="100"/>
<od:tableProperty name="ReadOnlyWhenDisconnected" type="1" value="0"/>
<od:tableProperty name="DatasheetGridlinesThemeColorIndex" type="4" value="-1"/>
<od:tableProperty name="DatasheetForeThemeColorIndex" type="4" value="-1"/>
<od:tableProperty name="PublishToWeb" type="2" value="1"/>
</xsd:appinfo>
</xsd:annotation>
<xsd:complexType>
<xsd:sequence>
<xsd:element name="Tipo" minOccurs="1" od:jetType="byte" od:sqlSType="tinyint" od:nonNullable="yes" type="xsd:unsignedByte">
<xsd:annotation>
<xsd:appinfo>
<od:fieldProperty name="GUID" type="9" value="zCPzWTmcR0yuW4nKrtGM/w==
"/>
<od:fieldProperty name="ColumnWidth" type="3" value="-1"/>
<od:fieldProperty name="ColumnOrder" type="3" value="0"/>
<od:fieldProperty name="ColumnHidden" type="1" value="0"/>
<od:fieldProperty name="DecimalPlaces" type="2" value="255"/>
<od:fieldProperty name="Required" type="1" value="1"/>
<od:fieldProperty name="DisplayControl" type="3" value="109"/>
<od:fieldProperty name="TextAlign" type="2" value="0"/>
<od:fieldProperty name="AggregateType" type="4" value="-1"/>
<od:fieldProperty name="ResultType" type="2" value="0"/>
<od:fieldProperty name="CurrencyLCID" type="4" value="0"/>
</xsd:appinfo>
</xsd:annotation>
</xsd:element>
<xsd:element name="Num" minOccurs="1" od:jetType="integer" od:sqlSType="smallint" od:nonNullable="yes" type="xsd:short">
<xsd:annotation>
<xsd:appinfo>
<od:fieldProperty name="GUID" type="9" value="4zFbhL5qqEOEQMF05hcArw==
"/>
<od:fieldProperty name="ColumnWidth" type="3" value="-1"/>
<od:fieldProperty name="ColumnOrder" type="3" value="0"/>
<od:fieldProperty name="ColumnHidden" type="1" value="0"/>
<od:fieldProperty name="DecimalPlaces" type="2" value="255"/>
<od:fieldProperty name="Required" type="1" value="1"/>
<od:fieldProperty name="DisplayControl" type="3" value="109"/>
<od:fieldProperty name="TextAlign" type="2" value="0"/>
<od:fieldProperty name="AggregateType" type="4" value="-1"/>
<od:fieldProperty name="ResultType" type="2" value="0"/>
<od:fieldProperty name="CurrencyLCID" type="4" value="0"/>
</xsd:appinfo>
</xsd:annotation>
</xsd:element>
<xsd:element name="Titulo" minOccurs="0" od:jetType="text" od:sqlSType="nvarchar">
<xsd:annotation>
<xsd:appinfo>
<od:fieldProperty name="GUID" type="9" value="7OYtuHQ2XEq3hWQnDbWu6A==
"/>
<od:fieldProperty name="ColumnWidth" type="3" value="-1"/>
<od:fieldProperty name="ColumnOrder" type="3" value="0"/>
<od:fieldProperty name="ColumnHidden" type="1" value="0"/>
<od:fieldProperty name="Required" type="1" value="0"/>
<od:fieldProperty name="AllowZeroLength" type="1" value="1"/>
<od:fieldProperty name="DisplayControl" type="3" value="109"/>
<od:fieldProperty name="IMEMode" type="2" value="0"/>
<od:fieldProperty name="IMESentenceMode" type="2" value="3"/>
<od:fieldProperty name="UnicodeCompression" type="1" value="1"/>
<od:fieldProperty name="TextAlign" type="2" value="0"/>
<od:fieldProperty name="AggregateType" type="4" value="-1"/>
<od:fieldProperty name="ResultType" type="2" value="0"/>
<od:fieldProperty name="CurrencyLCID" type="4" value="0"/>
</xsd:appinfo>
</xsd:annotation>
<xsd:simpleType>
<xsd:restriction base="xsd:string">
<xsd:maxLength value="255"/>
</xsd:restriction>
</xsd:simpleType>
</xsd:element>
<xsd:element name="Articulo" minOccurs="0" od:jetType="hyperlink" od:sqlSType="ntext" od:hyperlink="yes">
<xsd:annotation>
<xsd:appinfo>
<od:fieldProperty name="GUID" type="9" value="7789Gvf4/UyR28w1rNhfSQ==
"/>
<od:fieldProperty name="ColumnWidth" type="3" value="-1"/>
<od:fieldProperty name="ColumnOrder" type="3" value="0"/>
<od:fieldProperty name="ColumnHidden" type="1" value="0"/>
<od:fieldProperty name="Required" type="1" value="0"/>
<od:fieldProperty name="AllowZeroLength" type="1" value="1"/>
<od:fieldProperty name="IMEMode" type="2" value="0"/>
<od:fieldProperty name="IMESentenceMode" type="2" value="3"/>
<od:fieldProperty name="UnicodeCompression" type="1" value="1"/>
<od:fieldProperty name="TextAlign" type="2" value="0"/>
<od:fieldProperty name="AppendOnly" type="1" value="0"/>
<od:fieldProperty name="AggregateType" type="4" value="-1"/>
<od:fieldProperty name="ResultType" type="2" value="0"/>
<od:fieldProperty name="CurrencyLCID" type="4" value="0"/>
</xsd:appinfo>
</xsd:annotation>
<xsd:simpleType>
<xsd:restriction base="xsd:string">
<xsd:maxLength value="536870910"/>
</xsd:restriction>
</xsd:simpleType>
</xsd:element>
</xsd:sequence>
</xsd:complexType>
</xsd:element>
</xsd:schema>
